INSERT INTO EMP (EMPCODE, NAME, QUALIFICATION, PHONE, EMAIL, DESIGNATION, SALARY, REPORTS_TO)
VALUES
(100, 'RAJESH', 'BTECH', 789456123, 'rajesh@digisol.com', 'DEVELOPER', 101000),
(101, 'RAVI', 'MTECH', 798765432, 'ravi@digisol.com', 'PROJECT MANAGER', 120000, 100),
(102, 'VIJAY', 'BTECH', 765432198, 'vijay@digisol.com', 'TECHNICAL HEAD', 150000, 108),
(105, 'AJAY', 'BTECH', 743210987, 'ajay@digisol.com', 'PROJECT DIRECTOR', 180000, 102),
(106, 'BHASKAR', 'MTECH', 709876543, 'bhaskar@digisol.com', 'PRJOECT LEADER', 140000, 106),
(107, 'MANISH', 'MCA', 799008765, 'manish@digisol.com', 'DEVELOPER', 105000, 106),
(108, 'PRASAD', 'PHD', 712345678, 'prasad@digisol.com', 'CEO', 200000, NULL),
(109, 'RAKESH', 'MTECH', 791827364, 'rakesh@digisol.com', 'S. ENGINEER', 110000, 110),
(110, 'RAJ', 'MBA', 783726451, 'raj@digital.com', 'Developer', 102000, 108),
(111, 'RAKESH', 'MTECH', 756432109, 'rakesh@digisol.com', NULL, 108);

UPDATE EMP SET REPORTS_TO = 101 WHERE EMPCODE=100;
UPDATE EMP SET REPORTS_TO = 102 WHERE EMPCODE=101;
UPDATE EMP SET REPORTS_TO = 110 WHERE EMPCODE=102;
UPDATE EMP SET REPORTS_TO = 102 WHERE EMPCODE=108;
UPDATE EMP SET REPORTS_TO = 106 WHERE EMPCODE=110;
UPDATE EMP SET REPORTS_TO = 110 WHERE EMPCODE=106;
UPDATE EMP SET REPORTS_TO = 106 WHERE EMPCODE=105;
UPDATE EMP SET REPORTS_TO = NULL WHERE EMPCODE=107;
UPDATE EMP SET REPORTS_TO = 101 WHERE EMPCODE=112;
UPDATE EMP SET REPORTS_TO = 102 WHERE EMPCODE=118;
UPDATE EMP SET REPORTS_TO = 106 WHERE EMPCODE=109;
UPDATE EMP SET REPORTS_TO = 102 WHERE EMPCODE=120;
UPDATE EMP SET REPORTS_TO = 101 WHERE EMPCODE=111;
UPDATE EMP SET REPORTS_TO = 101 WHERE EMPCODE=130;






INSERT INTO SKILL (SKILLID, SKILLNAME)
VALUES ('S1', 'Full Stack')
INSERT INTO SKILL (SKILLID, SKILLNAME)
VALUES ('S2', 'Python');
INSERT INTO SKILL (SKILLID, SKILLNAME)
VALUES ('S3', 'Java');
INSERT INTO SKILL (SKILLID, SKILLNAME)
VALUES ('S4', 'C++');
INSERT INTO SKILL (SKILLID, SKILLNAME)
VALUES ('S6', 'Oracle');
INSERT INTO SKILL (SKILLID, SKILLNAME)
VALUES ('S7', 'Android');
INSERT INTO SKILL (SKILLID, SKILLNAME)
VALUES ('S8', 'AZURE');
INSERT INTO SKILL (SKILLID, SKILLNAME)
VALUES ('S9', '.NET');
INSERT INTO SKILL (SKILLID, SKILLNAME)
VALUES ('S10', 'iOS');





INSERT INTO CLIENT (CLIENTID, NAME, PHONE, EMAIL)
VALUES ('C1', 'ABC', '+48-87489389', 'aaa@abc.com');
INSERT INTO CLIENT (CLIENTID, NAME, PHONE, EMAIL)
VALUES ('C2', 'LTS', '+91-78389397', 'bbb@lts.com');
INSERT INTO CLIENT (CLIENTID, NAME, PHONE, EMAIL)
VALUES ('C3', 'RK', '+44-67838934', 'ccc@rk.com');
INSERT INTO CLIENT (CLIENTID, NAME, PHONE, EMAIL)
VALUES ('C4', 'MMA', '+31-77839093', 'ddd@mma.com');
INSERT INTO CLIENT (CLIENTID, NAME, PHONE, EMAIL)
VALUES ('C5', 'AKS', '+81-66822903', 'eee@aks.com');
INSERT INTO CLIENT (CLIENTID, NAME, PHONE, EMAIL)
VALUES ('C6', 'GKS', '+78/91-75628982', 'fff@gks.com');
ERROR at line 1:
ORA-02290: check constraint (DSE107.PHONE_FORMAT) violated
INSERT INTO CLIENT (CLIENTID, NAME, PHONE, EMAIL)
VALUES ('C7', 'B&B', '+91-64839839', 'ggg@bb.com');
INSERT INTO CLIENT (CLIENTID, NAME, PHONE, EMAIL)
VALUES ('C8', 'ABT', '+97/91-67554667', NULL);
ERROR at line 1:
ORA-02290: check constraint (DSE107.PHONE_FORMAT) violated
INSERT INTO CLIENT (CLIENTID, NAME, PHONE, EMAIL)
VALUES ('C9', 'XYZ', '+91-92108683', 'xyz./@ab.com');
 ERROR at line 1:
ORA-02290: check constraint (DSE107.VALID_EMAIL) violated
INSERT INTO CLIENT (CLIENTID, NAME, PHONE, EMAIL)
VALUES ('C10', 'ASD', '+91-7891234560', 'asd@asd.com');



INSERT INTO EMP_SKILL (EMPNO, SKILLID, SKILL_EXPERIENCE)
VALUES (100, 'S1', 15);
INSERT INTO EMP_SKILL (EMPNO, SKILLID, SKILL_EXPERIENCE)
VALUES (100, 'S3', 10);
INSERT INTO EMP_SKILL (EMPNO, SKILLID, SKILL_EXPERIENCE)
VALUES (101, 'S1', 6);
INSERT INTO EMP_SKILL (EMPNO, SKILLID, SKILL_EXPERIENCE)
VALUES (101, 'S2', 10);
INSERT INTO EMP_SKILL (EMPNO, SKILLID, SKILL_EXPERIENCE)
VALUES (102, 'S4', 18);
INSERT INTO EMP_SKILL (EMPNO, SKILLID, SKILL_EXPERIENCE)
VALUES (110, 'S1', 14);
INSERT INTO EMP_SKILL (EMPNO, SKILLID, SKILL_EXPERIENCE)
VALUES (110, 'S6', 20);
INSERT INTO EMP_SKILL (EMPNO, SKILLID, SKILL_EXPERIENCE)
VALUES (106, 'S2', 10);
INSERT INTO EMP_SKILL (EMPNO, SKILLID, SKILL_EXPERIENCE)
VALUES (106, 'S6', 12);
INSERT INTO EMP_SKILL (EMPNO, SKILLID, SKILL_EXPERIENCE)
VALUES (106, 'S8', 10);
INSERT INTO EMP_SKILL (EMPNO, SKILLID, SKILL_EXPERIENCE)
VALUES (108, 'S9', 5);
INSERT INTO EMP_SKILL (EMPNO, SKILLID, SKILL_EXPERIENCE)
VALUES (108, 'S6', 10);
INSERT INTO EMP_SKILL (EMPNO, SKILLID, SKILL_EXPERIENCE)
VALUES (105, 'S7', 12);
INSERT INTO EMP_SKILL (EMPNO, SKILLID, SKILL_EXPERIENCE)
VALUES (105, 'S10', 11);
INSERT INTO EMP_SKILL (EMPNO, SKILLID, SKILL_EXPERIENCE)
VALUES (101, 'S2/3', 7);
ERROR at line 1:
ORA-00001: unique constraint (DSE107.SYS_C0082375) violated
INSERT INTO EMP_SKILL VALUES (130, 'S5', 20);
INSERT INTO EMP_SKILL VALUES (130, 'S1', 20);







INSERT INTO WORK_EXP (EMPCODE, PRJID, WORK_EXPERIENCE, CLIENTID, RATING)
VALUES (100, 'P1', 20, 'C1', 'A');
INSERT INTO WORK_EXP (EMPCODE, PRJID, WORK_EXPERIENCE, CLIENTID, RATING)
VALUES (100, 'P3', 15, 'C3', 'A');
INSERT INTO WORK_EXP (EMPCODE, PRJID, WORK_EXPERIENCE, CLIENTID, RATING)
VALUES (101, 'P1', 16, 'C1', 'A');
INSERT INTO WORK_EXP (EMPCODE, PRJID, WORK_EXPERIENCE, CLIENTID, RATING)
VALUES (102, 'P2', 18, 'C2', 'B');
INSERT INTO WORK_EXP (EMPCODE, PRJID, WORK_EXPERIENCE, CLIENTID, RATING)
VALUES (102, 'P1', 18, 'C1', 'A');
INSERT INTO WORK_EXP (EMPCODE, PRJID, WORK_EXPERIENCE, CLIENTID, RATING)
VALUES (108, 'P2', 12, 'C2', 'C');
INSERT INTO WORK_EXP (EMPCODE, PRJID, WORK_EXPERIENCE, CLIENTID, RATING)
VALUES (106, 'P3', 20, 'C3', 'C');
INSERT INTO WORK_EXP (EMPCODE, PRJID, WORK_EXPERIENCE, CLIENTID, RATING)
VALUES (106, 'P4', 10, 'C4', 'C');
INSERT INTO WORK_EXP (EMPCODE, PRJID, WORK_EXPERIENCE, CLIENTID, RATING)
VALUES (105, 'P2', 19, 'C2', 'B');
INSERT INTO WORK_EXP (EMPCODE, PRJID, WORK_EXPERIENCE, CLIENTID, RATING)
VALUES (110, 'P4', 12, 'C4', 'B');
INSERT INTO WORK_EXP (EMPCODE, PRJID, WORK_EXPERIENCE, CLIENTID, RATING)
VALUES (110, 'P5', 16, 'C8', 'A');
INSERT INTO WORK_EXP (EMPCODE, PRJID, WORK_EXPERIENCE, CLIENTID, RATING)
VALUES (105, 'P5', 5, 'C5', 'D/C');
ERROR at line 1:
ORA-02290: check constraint (DSE107.SYS_C0082392) violated
INSERT INTO WORK_EXP (EMPCODE, PRJID, WORK_EXPERIENCE, CLIENTID, RATING)
VALUES (111, 'P5', 5, 'C5', 'C');
 INSERT INTO WORK_EXP VALUES (102, 'P3', 10, 'C5', 'B');




INSERT INTO PRJ_DETAILS (PRJID, PRJ_NAME, START_DATE, END_DATE, ACTUAL_END_DATE, LEAD_BY_EMPCODE, BUDGET_ALLOCATED, ACTUAL_BUDGET)
VALUES
('P1', 'SPYDER', TO_DATE('10-01-2020', 'DD-MM-YYYY'), TO_DATE('11-OCT-2022', 'DD-MM-YYYY'), NULL, 102, 2000000, 1990000);

INSERT INTO PRJ_DETAILS (PRJID, PRJ_NAME, START_DATE, END_DATE, ACTUAL_END_DATE, LEAD_BY_EMPCODE, BUDGET_ALLOCATED, ACTUAL_BUDGET)
VALUES
('P2', 'APOLLO', TO_DATE('01-01-2019', 'DD-MM-YYYY'), TO_DATE('10-JUL-2021', 'DD-MM-YYYY'), TO_DATE('30-12-2021', 'DD-MM-YYYY'), 108, 3000000, 3600000);

INSERT INTO PRJ_DETAILS (PRJID, PRJ_NAME, START_DATE, END_DATE, ACTUAL_END_DATE, LEAD_BY_EMPCODE, BUDGET_ALLOCATED, ACTUAL_BUDGET)
VALUES
('P3', 'UNICORN', TO_DATE('03-09-2021', 'DD-MM-YYYY'), TO_DATE('10-OCT-2023', 'DD-MM-YYYY'),NULL, 106, 7500000, 8000000);

INSERT INTO PRJ_DETAILS (PRJID, PRJ_NAME, START_DATE, END_DATE, ACTUAL_END_DATE, LEAD_BY_EMPCODE, BUDGET_ALLOCATED, ACTUAL_BUDGET)
VALUES
('P4', 'ZEUS', TO_DATE('28-02-2020', 'DD-MM-YYYY'), TO_DATE('09-JUN-2021', 'DD-MM-YYYY'), TO_DATE('10-01-2022', 'DD-MM-YYYY'), 110, 5500000, 5000000);

INSERT INTO PRJ_DETAILS (PRJID, PRJ_NAME, START_DATE, END_DATE, ACTUAL_END_DATE, LEAD_BY_EMPCODE, BUDGET_ALLOCATED, ACTUAL_BUDGET)
VALUES
('P5', 'JUPITOR', TO_DATE('07-08-2018', 'DD-MM-YYYY'), TO_DATE('04-FEB-2020', 'DD-MM-YYYY'), TO_DATE('01-NOV-2020', 'DD-MM-YYYY'), 110, 9000000, 9000000),

INSERT INTO PRJ_DETAILS (PRJID, PRJ_NAME, START_DATE, END_DATE, ACTUAL_END_DATE, LEAD_BY_EMPCODE, BUDGET_ALLOCATED, ACTUAL_BUDGET)
VALUES
('P6', 'MARS', TO_DATE('21-2-2022', 'DD-MM-YYYY'), TO_DATE('07-AUG-2020/2', 'DD-MM-YYYY'), NULL, 110, NULL, NULL);
ERROR at line 1:
ORA-02290: check constraint (DSE107.END_DATE_GREATER_START_DATE) violated

INSERT INTO PRJ_DETAILS (PRJID, PRJ_NAME, START_DATE, END_DATE, ACTUAL_END_DATE, LEAD_BY_EMPCODE, BUDGET_ALLOCATED, ACTUAL_BUDGET)
VALUES
(NULL/P8, 'XXX', NULL, NULL, NULL, NULL, NULL, NULL);
ERROR at line 3:
ORA-01400: cannot insert NULL into ("DSE107"."PRJ_DETAILS"."PRJID")

INSERT INTO PRJ_DETAILS (PRJID, PRJ_NAME, START_DATE, END_DATE, ACTUAL_END_DATE, LEAD_BY_EMPCODE, BUDGET_ALLOCATED, ACTUAL_BUDGET)
VALUES
('P7', 'EARTH', TO_DATE('01-01-2023', 'DD-MM-YYYY'), TO_DATE('10-JUL-2023', 'DD-MM-YYYY'), TO_DATE('30-12-2023', 'DD-MM-YYYY'), 108, 3000000, 3600000);

INSERT INTO PRJ_DETAILS (PRJID, PRJ_NAME, START_DATE, END_DATE, ACTUAL_END_DATE, LEAD_BY_EMPCODE, BUDGET_ALLOCATED, ACTUAL_BUDGET)
VALUES
('P9', 'ILLUMINATI', TO_DATE('01-01-2023', 'DD-MM-YYYY'), TO_DATE('01-JAN-2024', 'DD-MM-YYYY'), TO_DATE('01-01-2024', 'DD-MM-YYYY'), 107, 6000000, 9000000);





-- Insert data into MEDICAL_POLICY table
INSERT INTO MEDICAL_POLICY (EMPNO, POLICYNO, PREMIUM, POLICYDATE)
VALUES (100, 'MED001', 10000, TO_DATE('10-12-2020', 'DD-MM-YYYY'));
INSERT INTO MEDICAL_POLICY (EMPNO, POLICYNO, PREMIUM, POLICYDATE)
VALUES (101, 'MED003', 12000, TO_DATE('15-12-2020', 'DD-MM-YYYY'));
INSERT INTO MEDICAL_POLICY (EMPNO, POLICYNO, PREMIUM, POLICYDATE)
VALUES (100/5, 'MED001', 10000, TO_DATE('10-01-2021', 'DD-MM-YYYY'));
ERROR at line 1:
ORA-00001: unique constraint (DSE107.SYS_C0082405) violated
INSERT INTO MEDICAL_POLICY (EMPNO, POLICYNO, PREMIUM, POLICYDATE)
VALUES (101/6, 'MED003', 12000, TO_DATE('15-01-2021', 'DD-MM-YYYY'));
ERROR at line 1:
ORA-00001: unique constraint (DSE107.SYS_C0082405) violated
INSERT INTO MEDICAL_POLICY (EMPNO, POLICYNO, PREMIUM, POLICYDATE)
VALUES (103/8, 'MED004', 9000, TO_DATE('21-01-2021', 'DD-MM-YYYY'));
ERROR at line 1:
ORA-02291: integrity constraint (DSE107.SYS_C0082406) violated - parent key not
found






-- Insert data into FAMILY_DEPENDENTS table
INSERT INTO FAMILY_DEPENDENTS (EMPNO, DEP_NAME, RELATIONSHIP, AGE)
VALUES (100, 'AJITH', 'SON', 12);
INSERT INTO FAMILY_DEPENDENTS (EMPNO, DEP_NAME, RELATIONSHIP, AGE)
VALUES (100, 'PRITHVI', 'DAUGHTER', 9);
INSERT INTO FAMILY_DEPENDENTS (EMPNO, DEP_NAME, RELATIONSHIP, AGE)
VALUES (101, 'AARYA', 'DAUGHTER', 17);
INSERT INTO FAMILY_DEPENDENTS (EMPNO, DEP_NAME, RELATIONSHIP, AGE)
VALUES (101, 'AKANKSH', 'SON', 11);
INSERT INTO FAMILY_DEPENDENTS (EMPNO, DEP_NAME, RELATIONSHIP, AGE)
VALUES (101, 'ANITHA', 'SPOUSE', 43);




-- Insert data into PAY_CHECK table
INSERT INTO PAY_CHECK (EMPCODE, PAY_DATE, REGULAR_INCREMENT,PERFORMANCE_INCENTIVE,DA, PF, OTHER_INCENTIVES, ADVANCE_TAX)
VALUES (100, TO_DATE('01-12-2020', 'DD-MM-YYYY'), 2000, 1000, 10000, 5000, 2500, 5000);
INSERT INTO PAY_CHECK (EMPCODE, PAY_DATE, REGULAR_INCREMENT,PERFORMANCE_INCENTIVE,DA, PF, OTHER_INCENTIVES, ADVANCE_TAX)
VALUES (101, TO_DATE('01-12-2020', 'DD-MM-YYYY'), 3000, 2000, 50000, 7000, 5000, 7000);
INSERT INTO PAY_CHECK (EMPCODE, PAY_DATE, REGULAR_INCREMENT,PERFORMANCE_INCENTIVE,DA, PF, OTHER_INCENTIVES, ADVANCE_TAX)
VALUES (102, TO_DATE('01-12-2020', 'DD-MM-YYYY'), 3000, 3000, 90000, 8000, 3600, 7000);
INSERT INTO PAY_CHECK (EMPCODE, PAY_DATE, REGULAR_INCREMENT,PERFORMANCE_INCENTIVE,DA, PF, OTHER_INCENTIVES, ADVANCE_TAX)
VALUES (100, TO_DATE('01-01-2021', 'DD-MM-YYYY'), 3000, 3000, 80000, 1000, 450, 4000);
INSERT INTO PAY_CHECK (EMPCODE, PAY_DATE, REGULAR_INCREMENT,PERFORMANCE_INCENTIVE,DA, PF, OTHER_INCENTIVES, ADVANCE_TAX)
VALUES (101, TO_DATE('01-01-2021', 'DD-MM-YYYY'), 5000, 4000, 10000, 2000, 2100, 4000);
INSERT INTO PAY_CHECK (EMPCODE, PAY_DATE, REGULAR_INCREMENT,PERFORMANCE_INCENTIVE,DA, PF, OTHER_INCENTIVES, ADVANCE_TAX)
VALUES (102, TO_DATE('01-01-2021', 'DD-MM-YYYY'), 5000, 9000, 90000, 3000, NULL, 9000);
INSERT INTO PAY_CHECK (EMPCODE, PAY_DATE, REGULAR_INCREMENT,PERFORMANCE_INCENTIVE,DA, PF, OTHER_INCENTIVES, ADVANCE_TAX)
VALUES (103/5, TO_DATE('02-01-2021', 'DD-MM-YYYY'), 7000, 450, 4000, 2100, 900, 3000);
ERROR at line 1:
ORA-02291: integrity constraint (DSE107.SYS_C0082412) violated - parent key not
found



3.9
COMMIT;
DELETE FROM EMP WHERE EMPCODE = 100;
ERROR at line 1:
ORA-02292: integrity constraint (DSE107.FK_EMPNO) violated - child record found
-- Confirm the result with justification.

3.10
UPDATE EMP SET EMAIL = 'rajesh@digital.com' WHERE EMPCODE = 100;
ERROR at line 1:
ORA-02290: check constraint (DSE107.EMAIL_DOMAIN) violated


3.11
UPDATE WORK_EXP SET PRJID = 'P9' WHERE EMPCODE = 111;
ERROR at line 1:
ORA-02291: integrity constraint (DSE107.FK_WORK_EXP_PRJ) violated - parent key
not found/ NO P9 IN PRJ_DETAILS.


3.12
COMMIT;
DELETE FROM CLIENT WHERE CLIENTID = 'C1';
CLI NAME       PHONE          EMAIL
--- ---------- -------------- --------------------
C2  LTS        +91-78389397   bbb@lts.com
C3  RK         +44-67838934   ccc@rk.com
C4  MMA        +31-77839093   ddd@mma.com
C5  AKS        +81-66822903   eee@aks.com
C6  GKS        +91-75628982   fff@gks.com
C7  B          +91-64839839   ggg@bb.com
C8  ABT        +91-67554667
C9  XYZ        +91-92108683   xyz@ab.com


3.13
COMMIT;
DELETE FROM FAMILY_DEPENDENTS WHERE EMPNO = 100;

     EMPNO DEP_NAME             RELATIONSHIP            AGE
---------- -------------------- ---------------- ----------
       101 AARYA                DAUGHTER                 17
       101 AKANKSH              SON                      11
       101 ANITHA               SPOUSE                   43


3.14
UPDATE EMP SET SALARY = SALARY * 1.01 WHERE DESIGNATION = 'DEVELOPER';

  EMPCODE NAME       QUALIFI      PHONE EMAIL
---------- ---------- ------- ---------- --------------------
DESIGNATION              SALARY REPORTS_TO
-------------------- ---------- ----------
       100 RAJESH     BTECH    789456123 rajesh@digisol.com
DEVELOPER                102010

       102 VIJAY      BTECH    765432198 vijay@digisol.com
PROJECT MANAGER          150000

       101 RAVI       MTECH    798765432 ravi@digisol.com
PROJECT LEADER           120000


   EMPCODE NAME       QUALIFI      PHONE EMAIL
---------- ---------- ------- ---------- --------------------
DESIGNATION              SALARY REPORTS_TO
-------------------- ---------- ----------
       108 AJAY       BTECH    743210987 ajay@digisol.com
TECHNICAL HEAD           180000

       106 RAJ        MSC      783756451 raj@digisol.com
PROJECT LEADER           102000

       105 MANISH     MCA      799008765 manish@digisol.com
DEVELOPER                106050


   EMPCODE NAME       QUALIFI      PHONE EMAIL
---------- ---------- ------- ---------- --------------------
DESIGNATION              SALARY REPORTS_TO
-------------------- ---------- ----------
       107 PRASAD     PHD      712345678 prasad@digisol.com
CEO                      200000

       112 RAKESH     MTECH    791827964 rakesh1@digisol.com
DEVELOPER                111100

       118 RAKESH     MTECH    791827364 rakesh2@digisol.com
DEVELOPER                111100


   EMPCODE NAME       QUALIFI      PHONE EMAIL
---------- ---------- ------- ---------- --------------------
DESIGNATION              SALARY REPORTS_TO
-------------------- ---------- ----------
       109 RAKESH     MTECH    756432119 rakesh3@digisol.com
PROJECT LEADER           110000

       120 RAKESH     MTECH    656432109 rakesh4@digisol.com
DEVELOPER                121200

       111 RAJ        MSC      783726451 raj2@digisol.com
DEVELOPER                103020


   EMPCODE NAME       QUALIFI      PHONE EMAIL
---------- ---------- ------- ---------- --------------------
DESIGNATION              SALARY REPORTS_TO
-------------------- ---------- ----------
       130 RISHIK     PHD     6549321879 rishik@digisol.com
PROJECT LEADER           300000

       110 BHASKAR    MTECH    709876543 bhaskar@digisol.com
DEVELOPER                141400

3.15
UPDATE EMP SET REPORTS_TO = 106 WHERE EMPCODE = 108;

3.16
UPDATE EMP SET REPORTS_TO = 117 WHERE EMPCODE = 108;
ERROR at line 1:
ORA-02291: integrity constraint (DSE107.FK_REPORTS_TO_EMPCODE) violated -
parent key not found/NO 117
COMMIT;





